[
  {
    "id": "runtime.catalog",
    "title": "Health and model inventory",
    "dashboardTouchpoints": [
      "/",
      "/chat",
      "/agents"
    ],
    "endpointCount": 4,
    "endpoints": [
      {
        "method": "GET",
        "path": "/health",
        "handler": "health"
      },
      {
        "method": "GET",
        "path": "/v1/agents",
        "handler": "agents_metadata"
      },
      {
        "method": "GET",
        "path": "/v1/agents/registry",
        "handler": "agents_registry"
      },
      {
        "method": "GET",
        "path": "/v1/models",
        "handler": "models"
      }
    ],
    "statusTag": null,
    "completionStatus": "live_partial",
    "notes": [
      "Grouped from FastAPI route decorators in server.py.",
      "Dashboard touchpoints are inferred from the current atlas/runtime model."
    ]
  },
  {
    "id": "runtime.chat",
    "title": "Chat completions",
    "dashboardTouchpoints": [
      "/chat",
      "/agents"
    ],
    "endpointCount": 1,
    "endpoints": [
      {
        "method": "POST",
        "path": "/v1/chat/completions",
        "handler": "chat_completions"
      }
    ],
    "statusTag": null,
    "completionStatus": "live_partial",
    "notes": [
      "Grouped from FastAPI route decorators in server.py.",
      "Dashboard touchpoints are inferred from the current atlas/runtime model."
    ]
  },
  {
    "id": "runtime.history-outputs",
    "title": "History and outputs",
    "dashboardTouchpoints": [
      "/activity",
      "/conversations",
      "/outputs"
    ],
    "endpointCount": 4,
    "endpoints": [
      {
        "method": "GET",
        "path": "/v1/activity",
        "handler": "get_activity"
      },
      {
        "method": "GET",
        "path": "/v1/conversations",
        "handler": "get_conversations"
      },
      {
        "method": "GET",
        "path": "/v1/outputs",
        "handler": "list_outputs"
      },
      {
        "method": "GET",
        "path": "/v1/outputs/{path:path}",
        "handler": "read_output"
      }
    ],
    "statusTag": null,
    "completionStatus": "live_partial",
    "notes": [
      "Grouped from FastAPI route decorators in server.py.",
      "Dashboard touchpoints are inferred from the current atlas/runtime model."
    ]
  },
  {
    "id": "runtime.memory",
    "title": "Preferences and memory",
    "dashboardTouchpoints": [
      "/preferences",
      "/personal-data"
    ],
    "endpointCount": 3,
    "endpoints": [
      {
        "method": "GET",
        "path": "/v1/preferences",
        "handler": "get_preferences"
      },
      {
        "method": "POST",
        "path": "/v1/preferences",
        "handler": "add_preference"
      },
      {
        "method": "GET",
        "path": "/v1/preferences/models",
        "handler": "get_model_preferences"
      }
    ],
    "statusTag": null,
    "completionStatus": "live_partial",
    "notes": [
      "Grouped from FastAPI route decorators in server.py.",
      "Dashboard touchpoints are inferred from the current atlas/runtime model."
    ]
  },
  {
    "id": "runtime.routing-context",
    "title": "Routing and context",
    "dashboardTouchpoints": [
      "/chat",
      "/agents"
    ],
    "endpointCount": 2,
    "endpoints": [
      {
        "method": "POST",
        "path": "/v1/context/preview",
        "handler": "preview_context"
      },
      {
        "method": "POST",
        "path": "/v1/routing/classify",
        "handler": "classify_route"
      }
    ],
    "statusTag": null,
    "completionStatus": "live_partial",
    "notes": [
      "Grouped from FastAPI route decorators in server.py.",
      "Dashboard touchpoints are inferred from the current atlas/runtime model."
    ]
  },
  {
    "id": "runtime.status",
    "title": "Service and media status",
    "dashboardTouchpoints": [
      "/services",
      "/media"
    ],
    "endpointCount": 2,
    "endpoints": [
      {
        "method": "GET",
        "path": "/v1/status/media",
        "handler": "media_status"
      },
      {
        "method": "GET",
        "path": "/v1/status/services",
        "handler": "services_status"
      }
    ],
    "statusTag": null,
    "completionStatus": "live_partial",
    "notes": [
      "Grouped from FastAPI route decorators in server.py.",
      "Dashboard touchpoints are inferred from the current atlas/runtime model."
    ]
  },
  {
    "id": "runtime.subsystem.goals-workplan",
    "title": "Goals and workplan",
    "dashboardTouchpoints": [
      "/goals",
      "/workplanner",
      "/tasks"
    ],
    "endpointCount": 9,
    "endpoints": [
      {
        "method": "GET",
        "path": "/v1/goals",
        "handler": "get_goals"
      },
      {
        "method": "POST",
        "path": "/v1/goals",
        "handler": "create_goal_endpoint"
      },
      {
        "method": "DELETE",
        "path": "/v1/goals/{goal_id}",
        "handler": "delete_goal_endpoint"
      },
      {
        "method": "GET",
        "path": "/v1/projects",
        "handler": "get_projects"
      },
      {
        "method": "GET",
        "path": "/v1/projects/{project_id}",
        "handler": "get_project_detail"
      },
      {
        "method": "GET",
        "path": "/v1/scheduling/status",
        "handler": "scheduling_status"
      },
      {
        "method": "GET",
        "path": "/v1/workplan",
        "handler": "get_workplan"
      },
      {
        "method": "POST",
        "path": "/v1/workplan/generate",
        "handler": "trigger_workplan"
      },
      {
        "method": "POST",
        "path": "/v1/workplan/redirect",
        "handler": "redirect_workplan"
      }
    ],
    "statusTag": "live",
    "completionStatus": "live_partial",
    "notes": [
      "Grouped from FastAPI route decorators in server.py.",
      "Dashboard touchpoints are inferred from the current atlas/runtime model."
    ]
  },
  {
    "id": "runtime.subsystem.notifications-escalation",
    "title": "Notifications and trust",
    "dashboardTouchpoints": [
      "/notifications",
      "/review",
      "/tasks"
    ],
    "endpointCount": 12,
    "endpoints": [
      {
        "method": "GET",
        "path": "/v1/alerts",
        "handler": "get_alerts"
      },
      {
        "method": "POST",
        "path": "/v1/alerts/check",
        "handler": "trigger_alert_check"
      },
      {
        "method": "GET",
        "path": "/v1/autonomy",
        "handler": "get_autonomy_adjustments"
      },
      {
        "method": "POST",
        "path": "/v1/autonomy/reset",
        "handler": "reset_autonomy"
      },
      {
        "method": "GET",
        "path": "/v1/escalation/config",
        "handler": "get_escalation_config"
      },
      {
        "method": "POST",
        "path": "/v1/escalation/evaluate",
        "handler": "evaluate_escalation"
      },
      {
        "method": "POST",
        "path": "/v1/feedback",
        "handler": "post_feedback"
      },
      {
        "method": "POST",
        "path": "/v1/feedback/implicit",
        "handler": "post_implicit_feedback"
      },
      {
        "method": "GET",
        "path": "/v1/notification-budget",
        "handler": "get_notification_budget"
      },
      {
        "method": "GET",
        "path": "/v1/notifications",
        "handler": "get_notifications"
      },
      {
        "method": "POST",
        "path": "/v1/notifications/{action_id}/resolve",
        "handler": "resolve_notification"
      },
      {
        "method": "GET",
        "path": "/v1/trust",
        "handler": "get_trust_scores"
      }
    ],
    "statusTag": "live",
    "completionStatus": "live_partial",
    "notes": [
      "Grouped from FastAPI route decorators in server.py.",
      "Dashboard touchpoints are inferred from the current atlas/runtime model."
    ]
  },
  {
    "id": "runtime.subsystem.patterns-learning",
    "title": "Patterns and learning",
    "dashboardTouchpoints": [
      "/insights",
      "/learning",
      "/review"
    ],
    "endpointCount": 6,
    "endpoints": [
      {
        "method": "GET",
        "path": "/v1/briefing",
        "handler": "get_briefing"
      },
      {
        "method": "GET",
        "path": "/v1/learning/metrics",
        "handler": "learning_metrics"
      },
      {
        "method": "GET",
        "path": "/v1/metrics/agents",
        "handler": "agent_metrics"
      },
      {
        "method": "GET",
        "path": "/v1/metrics/inference",
        "handler": "inference_metrics"
      },
      {
        "method": "GET",
        "path": "/v1/patterns",
        "handler": "get_patterns"
      },
      {
        "method": "POST",
        "path": "/v1/patterns/run",
        "handler": "trigger_pattern_detection"
      }
    ],
    "statusTag": "live",
    "completionStatus": "live_partial",
    "notes": [
      "Grouped from FastAPI route decorators in server.py.",
      "Dashboard touchpoints are inferred from the current atlas/runtime model."
    ]
  },
  {
    "id": "runtime.subsystem.skills-research-consolidation",
    "title": "Skills, research jobs, and consolidation",
    "dashboardTouchpoints": [
      "/learning",
      "/workplanner",
      "/personal-data"
    ],
    "endpointCount": 13,
    "endpoints": [
      {
        "method": "POST",
        "path": "/v1/consolidate",
        "handler": "run_consolidation_endpoint"
      },
      {
        "method": "GET",
        "path": "/v1/consolidate/stats",
        "handler": "consolidation_stats"
      },
      {
        "method": "GET",
        "path": "/v1/research/jobs",
        "handler": "list_research_jobs"
      },
      {
        "method": "POST",
        "path": "/v1/research/jobs",
        "handler": "create_research_job"
      },
      {
        "method": "DELETE",
        "path": "/v1/research/jobs/{job_id}",
        "handler": "delete_research_job"
      },
      {
        "method": "POST",
        "path": "/v1/research/jobs/{job_id}/execute",